{
  "schema": 1,
  "product": "animosis-studio",
  "channel": "stable",
  "version": "0.5.0",
  "serial": 42,
  "released": "2026-09-22T17:00:00Z",
  "minPatcher": "0.3.0",
  "baseUrl": "https://cdn.animosis.studio/animosis-studio/stable/",
  "notes": "https://animosis.studio/releases/0.5.0",

  "packages": [
    {
      "id": "animosis.schema",
      "version": "0.5.0",
      "platform": "any",
      "required": true,
      "installPath": "schema",
      "dependsOn": [],
      "artifact": {
        "url": "pkg/animosis.schema/0.5.0.tar.zst",
        "size": 1148096,
        "sha256": "3b1f0c9d8e7a6b5c4d3e2f1a0b9c8d7e6f5a4b3c2d1e0f9a8b7c6d5e4f3a2b1c",
        "unpackedSize": 4194304
      },
      "deltas": [
        {
          "from": "0.4.0",
          "format": "zstd-patch",
          "url": "delta/animosis.schema/0.4.0-0.5.0.zpatch",
          "size": 88420,
          "sha256": "9f8e7d6c5b4a39281706f5e4d3c2b1a09f8e7d6c5b4a39281706f5e4d3c2b1a0",
          "resultSha256": "3b1f0c9d8e7a6b5c4d3e2f1a0b9c8d7e6f5a4b3c2d1e0f9a8b7c6d5e4f3a2b1c"
        }
      ]
    },

    {
      "id": "animosis.core",
      "version": "0.5.0",
      "platform": "win-x64",
      "required": true,
      "installPath": "core",
      "dependsOn": ["animosis.schema"],
      "artifact": {
        "url": "pkg/animosis.core/0.5.0-win-x64.tar.zst",
        "size": 62914560,
        "sha256": "a1b2c3d4e5f60718293a4b5c6d7e8f90a1b2c3d4e5f60718293a4b5c6d7e8f90",
        "unpackedSize": 188743680
      },
      "deltas": [
        {
          "from": "0.4.1",
          "format": "zstd-patch",
          "url": "delta/animosis.core/0.4.1-0.5.0-win-x64.zpatch",
          "size": 19087654,
          "sha256": "0f9e8d7c6b5a49382716f5e4d3c2b1a00f9e8d7c6b5a49382716f5e4d3c2b1a0",
          "resultSha256": "a1b2c3d4e5f60718293a4b5c6d7e8f90a1b2c3d4e5f60718293a4b5c6d7e8f90"
        }
      ]
    },

    {
      "id": "animosis.terrain",
      "version": "0.5.0",
      "platform": "win-x64",
      "required": true,
      "installPath": "core/terrain",
      "dependsOn": ["animosis.core"],
      "artifact": {
        "url": "pkg/animosis.terrain/0.5.0-win-x64.tar.zst",
        "size": 358318080,
        "sha256": "c3d4e5f60718293a4b5c6d7e8f90a1b2c3d4e5f60718293a4b5c6d7e8f90a1b2",
        "unpackedSize": 1073741824
      },
      "deltas": []
    },

    {
      "id": "animosis.samples",
      "version": "0.5.0",
      "platform": "any",
      "required": false,
      "installPath": "samples",
      "dependsOn": ["animosis.core"],
      "artifact": {
        "url": "pkg/animosis.samples/0.5.0.tar.zst",
        "size": 104857600,
        "sha256": "e5f60718293a4b5c6d7e8f90a1b2c3d4e5f60718293a4b5c6d7e8f90a1b2c3d4",
        "unpackedSize": 314572800
      },
      "deltas": []
    }
  ]
}
